{
  "$schema": "https://json-schema.org/draft/2020-12/schema",
  "$id": "https://opensyria.org/schemas/data-geography/subdistricts.schema.json",
  "title": "OpenSyria Geography Subdistricts",
  "type": "array",
  "items": {
    "type": "object",
    "additionalProperties": false,
    "required": [
      "id",
      "districtId",
      "governorateId",
      "name",
      "aliases",
      "centroid",
      "area",
      "population",
      "externalIds",
      "sourceIds",
      "sourceStatus"
    ],
    "properties": {
      "id": {
        "type": "string",
        "pattern": "^sy-[a-z0-9]+(?:-[a-z0-9]+)*$"
      },
      "districtId": {
        "type": "string",
        "pattern": "^sy-[a-z0-9]+(?:-[a-z0-9]+)*$"
      },
      "governorateId": {
        "type": "string",
        "pattern": "^sy-[a-z0-9]+(?:-[a-z0-9]+)*$"
      },
      "name": {
        "$ref": "#/$defs/localizedText"
      },
      "aliases": {
        "$ref": "#/$defs/aliases"
      },
      "centroid": {
        "$ref": "#/$defs/nullableGeographicPoint"
      },
      "area": {
        "$ref": "#/$defs/nullableAreaMeasurement"
      },
      "population": {
        "$ref": "#/$defs/nullablePopulationMeasurement"
      },
      "populationHistory": {
        "$ref": "#/$defs/populationHistory"
      },
      "externalIds": {
        "$ref": "#/$defs/externalIds"
      },
      "sourceIds": {
        "$ref": "#/$defs/sourceIds"
      },
      "sourceStatus": {
        "$ref": "#/$defs/sourceStatus"
      },
      "notes": {
        "type": "string",
        "minLength": 1
      }
    }
  },
  "$defs": {
    "localizedText": {
      "type": "object",
      "additionalProperties": false,
      "required": ["en"],
      "properties": {
        "en": {
          "type": "string",
          "minLength": 1
        },
        "ar": {
          "type": "string",
          "minLength": 1
        }
      }
    },
    "aliases": {
      "type": "array",
      "items": {
        "type": "object",
        "additionalProperties": false,
        "required": ["value"],
        "properties": {
          "value": {
            "type": "string",
            "minLength": 1
          },
          "language": {
            "type": "string",
            "enum": ["ar", "en", "und"]
          },
          "type": {
            "type": "string",
            "enum": ["alias", "formal", "transliteration", "historical", "alternate_spelling"]
          }
        }
      }
    },
    "nullableGeographicPoint": {
      "oneOf": [
        {
          "type": "null"
        },
        {
          "type": "object",
          "additionalProperties": false,
          "required": ["latitude", "longitude"],
          "properties": {
            "latitude": {
              "type": "number",
              "minimum": -90,
              "maximum": 90
            },
            "longitude": {
              "type": "number",
              "minimum": -180,
              "maximum": 180
            }
          }
        }
      ]
    },
    "nullableAreaMeasurement": {
      "oneOf": [
        {
          "type": "null"
        },
        {
          "type": "object",
          "additionalProperties": false,
          "required": ["value", "unit", "sourceIds"],
          "properties": {
            "value": {
              "type": "number",
              "exclusiveMinimum": 0
            },
            "unit": {
              "type": "string",
              "const": "km2"
            },
            "sourceIds": {
              "$ref": "#/$defs/sourceIds"
            },
            "notes": {
              "type": "string",
              "minLength": 1
            }
          }
        }
      ]
    },
    "nullablePopulationMeasurement": {
      "oneOf": [
        {
          "type": "null"
        },
        {
          "type": "object",
          "additionalProperties": false,
          "required": ["value", "year", "sourceIds"],
          "properties": {
            "value": {
              "type": "integer",
              "minimum": 0
            },
            "year": {
              "type": "integer",
              "minimum": 1,
              "maximum": 9999
            },
            "date": {
              "type": "string",
              "pattern": "^[0-9]{4}-[0-9]{2}-[0-9]{2}$"
            },
            "sourceIds": {
              "$ref": "#/$defs/sourceIds"
            },
            "notes": {
              "type": "string",
              "minLength": 1
            }
          }
        }
      ]
    },
    "populationHistory": {
      "type": "array",
      "minItems": 1,
      "items": {
        "type": "object",
        "additionalProperties": false,
        "required": ["value", "year", "sourceIds"],
        "properties": {
          "value": {
            "type": "integer",
            "minimum": 0
          },
          "year": {
            "type": "integer",
            "minimum": 1,
            "maximum": 9999
          },
          "date": {
            "type": "string",
            "pattern": "^[0-9]{4}-[0-9]{2}-[0-9]{2}$"
          },
          "sourceIds": {
            "$ref": "#/$defs/sourceIds"
          },
          "notes": {
            "type": "string",
            "minLength": 1
          }
        }
      }
    },
    "externalIds": {
      "type": "object",
      "additionalProperties": false,
      "properties": {
        "wikidata": {
          "type": "string",
          "pattern": "^Q[0-9]+$"
        },
        "geonames": {
          "type": "string",
          "pattern": "^[0-9]+$"
        },
        "geoboundaries": {
          "type": "string",
          "minLength": 1
        },
        "ochaPcode": {
          "type": "string",
          "minLength": 1
        }
      }
    },
    "sourceIds": {
      "type": "array",
      "items": {
        "type": "string",
        "minLength": 1
      },
      "minItems": 1,
      "uniqueItems": true
    },
    "sourceStatus": {
      "type": "string",
      "enum": ["pending_release", "seed", "released", "deprecated"]
    }
  }
}
