[
  {
    "id": "sy-example-governorate-example-district-example-subdistrict",
    "districtId": "sy-example-governorate-example-district",
    "governorateId": "sy-example-governorate",
    "name": {
      "en": "Example Subdistrict",
      "ar": "\u0646\u0627\u062d\u064a\u0629 \u0645\u062b\u0627\u0644"
    },
    "aliases": [],
    "centroid": null,
    "area": null,
    "population": null,
    "externalIds": {},
    "sourceIds": ["fixture-source"],
    "sourceStatus": "seed",
    "notes": "Fixture record only. Do not copy into canonical data."
  }
]
